{
  "contractVersion": 1,
  "bridgeVersion": "0.1.0",
  "runStartedAt": "2026-10-13T16:58:02.114Z",
  "sentAt": "2026-10-13T18:12:00.004Z",
  "status": "ok",
  "backlog": 0,
  "lastDbContactAt": "2026-10-13T18:11:59.871Z",
  "queryMs": 14,
  "sourceClockOffsetMs": -2310,
  "heldBack": [{ "displayMode": 5, "cards": 1 }],
  "sourceFingerprint": {
    "version": "9",
    "scheiben": 1532,
    "treffer": 45008,
    "oldestStamp": "2024-10-11 20:31:09"
  }
}
